Modified:,2025,,,,,,,,,,,,,,,,,,,
Key,Value,,,,,,,,,,,,,,,,,,,
Title,Abhayagiri Monastic Retreat 2013,,,,,,,,,,,,,,,,,,,
Subtitle,Brightening the Mind,,,,,,,,,,,,,,,,,,,
Code,TG2013,,,,,,,,,,,,,,,,,,,
Series,Thanksgiving Retreats,,,,,,,,,,,,,,,,,,,
Venue,Angela Center,,,,,,,,,,,,,,,,,,,
Teachers,AP;AKd;ANy;DS,,,,,,,,,,,,,,,,,,,
Start date,22/11/2013,,,,,,,,,,,,,,,,,,,
End date,1/12/2013,,,,,,,,,,,,,,,,,,,
Format,Multiday event,,,,,,,,,,,,,,,,,,,
Medium,In-person,,,,,,,,,,,,,,,,,,,
Tags,,,,,,,,,,,,,,,,,,,,
Website,https://www.abhayagiri.org/media/discs/APasannoRetreats/2013%20Thanksgiving%20Retreat/Index.html,,,,,,,,,,,,,,,,,,,
Description,A classic ten-day Thanksgiving Retreat held at the Angela Center before it closed due to fire damage.,,,,,,,,,,,,,,,,,,,
Sessions,8,,,,,,,,,,,,,,,,,,,
Excerpts,176,,,,,,,,,,,,,,,,,,,
Answers listened to,38,,,,,,,,,,,,,,,,,,,
Tags applied,486,,,,,,,,,,,,,,,,,,,
Invalid tags,0,,,,,,,,,,,,,,,,,,,
Duration,7:52:27,,,,,,,,,,,,,,,,,,,
<---->,,,,,,,,,,,,,,,,,,,,
Session #,Date,Filename,Duration,Session title,Remote mp3 URL,Excerpts,Tags,Tags 2,Tags 3,Teachers,Exclude?,Seconds,,,,,,,,
1,23/11/2013,AP_11_23_2013_Monastic_Retreat_eve_Questions_and_Answers_1.mp3,43:37,,https://www.abhayagiri.org/media/discs/APasannoRetreats/2013%20Thanksgiving%20Retreat/Audio/AP_11_23_2013_Monastic_Retreat_eve_Questions_and_Answers_1.mp3,10,,,,AP,,2617,,,,,,,,
2,24/11/2013,AP_11_24_2013_Monastic_Retreat_eve_Questions_and_Answers_2.mp3,53:12,,https://www.abhayagiri.org/media/discs/APasannoRetreats/2013%20Thanksgiving%20Retreat/Audio/AP_11_24_2013_Monastic_Retreat_eve_Questions_and_Answers_2.mp3,20,,,,AP,,3192,,,,,,,,
3,25/11/2013,AP_11_25_2013_Monastic_Retreat_eve_Questions_and_Answers_3.mp3,1:06:00,,https://www.abhayagiri.org/media/discs/APasannoRetreats/2013%20Thanksgiving%20Retreat/Audio/AP_11_25_2013_Monastic_Retreat_eve_Questions_and_Answers_3.mp3,27,,,,AP,,3960,,,,,,,,
4,26/11/2013,AP_11_26_2013_Monastic_Retreat_eve_Questions_and_Answers_4.mp3,58:08,,https://www.abhayagiri.org/media/discs/APasannoRetreats/2013%20Thanksgiving%20Retreat/Audio/AP_11_26_2013_Monastic_Retreat_eve_Questions_and_Answers_4.mp3,18,,,,AP,,3488,,,,,,,,
5,27/11/2013,AP_11_27_2013_Monastic_Retreat_eve_Questions_and_Answers_5.mp3,56:34,,https://www.abhayagiri.org/media/discs/APasannoRetreats/2013%20Thanksgiving%20Retreat/Audio/AP_11_27_2013_Monastic_Retreat_eve_Questions_and_Answers_5.mp3,19,,,,AP,,3394,,,,,,,,
6,28/11/2013,AP_11_28_2013_Monastic_Retreat_eve_Questions_and_Answers_6.mp3,56:09,,https://www.abhayagiri.org/media/discs/APasannoRetreats/2013%20Thanksgiving%20Retreat/Audio/AP_11_28_2013_Monastic_Retreat_eve_Questions_and_Answers_6.mp3,22,,,,AP,,3369,,,,,,,,
7,29/11/2013,AP_11_29_2013_Monastic_Retreat_eve_Questions_and_Answers_7.mp3,1:21:24,,https://www.abhayagiri.org/media/discs/APasannoRetreats/2013%20Thanksgiving%20Retreat/Audio/AP_11_29_2013_Monastic_Retreat_eve_Questions_and_Answers_7.mp3,37,,,,AP,,4884,,,,,,,,
8,30/11/2013,AP_11_30_2013_Monastic_Retreat_eve_Questions_and_Answers_8.mp3,57:23,,https://www.abhayagiri.org/media/discs/APasannoRetreats/2013%20Thanksgiving%20Retreat/Audio/AP_11_30_2013_Monastic_Retreat_eve_Questions_and_Answers_8.mp3,23,,,,AP,,3443,,,,,,,,
,,,,,,,,,,,,,,,,,,,,
,,,,,,,,,,,,,,,,,,,,
<---->,,,,,,,,,,,,,,,,,,,,
Session #,Kind,Flags,Start time,End time,Teachers,Text,QTag1,QTag2,QTag3,QTag4,ATag1,ATag2,ATag3,ATag4,ATag5,ATag6,AListen?,Exclude?,FTags,FTagOrder
1,,,0:05,4:24,,"Thank you for your talk. Can you flesh out: 'dispassionate about what?' Also, trying to encourage dispassion along with arousing energy.",Dispassion,Energy,,,Craving,Sense bases,Form,Emotion,Contentment,Tranquility,Yes,,Dispassion,100
1,Quote,,,,,"When there's a coolness towards the world around one, that frees up a lot of energy for directing attention to what's actually useful and beneficial.",Dispassion,Energy,Discernment,,,,,,,,,,,
1,,,4:26,13:18,,"Is it possible for an arahant to have seemingly negative thoughts or speech while free from defilement? In the Udana, Venerable Pilindavaccha gets complained about for calling monks outcastes or lowlings.",Arahant,Unskillful qualities,Great disciples,Harsh speech,,,,,,,Yes,,,
1,Sutta,,,,,Ud 3.6: Pilindavaccha.,,,,,,,,,,,,,,
1,Indirect quote,,,,,Purity or impurity—you have to know for yourself.|Ajahn Chah,Ajahn Chah,,,,,,,,,,,,,
1,Vinaya,,,,,Kd 18.11.14 and Kd 18.12.8.4: Students and teachers are mutually accountable.,Vinaya,Mentoring,,,,,,,,,,,,
1,,,13:19 ,,,Can you talk about how to work with infidelity.,Relationships,Sexual misconduct,,,,,,,,,,,,
1,,,22:38 ,,,Thank you for the wonderful teachings...Can you further discuss dispassion and nonattachment in the context of the 'middle way.' (particularly for a layperson in a loving relationship),Relationships,Dispassion,,,,,,,,,,,,
1,,,31:37 ,,,I notice that when my mind is drifting I don't feel physical pain but when 'present' pain comes to the fore. Suggestions?,Pain,,,,,,,,,,,,,
1,,,38:25 ,,,What do you think about the bed here? I believe its against the 8th precept.,High and luxurious beds,,,,,,,,,,,,,
2,,,0:00 ,,,I have seen both monastics and laypeople start getting ill after they became serious about practice. Can you relate this to your talk today? (whether such illness is karmic. Etc.),Sickness,Kamma,,,,,,,,,,,,
2,,,3:51 ,7:06,,"Could you clarify the difference between perception (sañña), mental formations (saṅkhāra) and conscousness (viññana)?",Perception,Volitional formations,Consciousness,,Memory,Mindfulness,Translation,Volition,Sense bases,,Yes,,Perception,80
2,,,7:06 ,,,Can you talk about neither-painful-nor-pleasant feelings and the benefits of being with this boringness?,Neutral feeling,Mindfulness of feeling,,,,,,,,,,,,
2,,,10:33 ,13:19,,"Could you please talk about different places in the chain of dependent origination can be broken? For example, does contact always result in vedanā? If the intention to be conscious is let go of, is that breaking the chain of ignorance conditioning saṅkhāra and saṅkhāra conditioning viññana?",Dependent origination,Contact,Feeling,Ignorance,Craving,Clinging,Becoming,Relinquishment,,,Yes,,Dependent origination,120
2,Extra tags,,,,,,Volitional formations,Consciousness,,,,,,,,,,,,
2,,,13:20 ,,,Thank you for the wonderful dhamma talk on the 5 reflections! Could you please talk about compassion in caregiving for themselves and for others.,Recollection,Compassion,Health care,,,,,,,,,,,
2,,,17:46 ,,,Reflecting on your talk earlier about letting go...Wondering if you can speak about maintaining a practice during retreat and also in 'normal' life under circumstances (where one has to make many important decisions).,Relinquishment,Meditation retreats,Lay life,,,,,,,,,,,
2,,,21:53 ,26:51,,"During meditation when thoughts come and want to engage me, some thoughts have the power to take me into the storyline, and I don't even know why. I don't even know when. Is there a point, sign,or warning that can be seen before I get lost? It's really painful to live in a virtual reality that never delivers the promise.",Restlessness and worry,Proliferation,Suffering,,Mindfulness of body,Ajahn Pasanno,Feeling,Dreams,,,Yes,,Proliferation,90
2,Extra tags,,,,,,,,,,,,,,,,,,Mindfulness of body,90
2,Cut audio,,26:06.5,26:12,,,,,,,,,,,,,Yes,,,
2,Quote,,,,,"Tuning into the body, I can start to feel where [the thought] is taking me.",Mindfulness of body,,,,,,,,,,,,,
2,Indirect quote,,,,,"You know what the quickest way to enlightenment is? Just look at the thoughts, point your finger, and say 'Liar!'|Ajahn Chah",Ajahn Chah,Liberation,Proliferation,Truth,,,,,,,,,,
2,,,26:53,32:19,,"Dear Ajahn Pasanno, Thank you for all the guidance and encouragement. The past months have been very busy and stressful for me. Now as I begin to let my mind settle, I'm noticing lots of patterns of tension in my heart, diaphram, belly, etc. These tensions sometimes make the breath an unpleasant object to stay with. Any advice?",Mindfulness of body,Mindfulness of breathing,Suffering,,Body scanning,Visualization,Calming meditation,Goodwill,,,Yes,,,
2,,,32:19 ,,,"In letting go of thoughts that habitually arise from negative self-criticism or from past trauma defenses, how do we ask these powerful mental states to not overwhelm our mindfulness?",Guilt/shame/inadequacy,Mindfulness,,,,,,,,,,,,
2,,,33:14 ,,,Could you clarify whether having more than one meditation object is a help or a hindrance?,Meditation/General advice,,,,,,,,,,,,,
2,,,39:17 ,44:43,,"Thank you for your uplifting and encouraging talks. My husband died 6 months ago. Could you give suggestions for how to contemplate anicca and anatta in the context of his life, illness, and death? I'm aware of aversion to the pain of losing him. I do want to learn from all this.",Impermanence,Not-self,Sickness,Death,Naturalness,Grief,Gratitude,Merit,Compassion,,Yes,,Suffering,130
2,Extra tags,,,,,,Relationships,Aversion,Suffering,,,,,,,,,,,
2,,,44:43 ,,,Is there a distinction between dispassion and equanimity?,Dispassion,Equanimity,,,,,,,,,,,,
2,,,46:09 ,,,Thank you for your wonderful teaching. Q: How to identify and deal with 'Panca upadana' in daily life?,Clinging,Aggregates,,,,,,,,,,,,
2,,,49:56 ,,,"Ajahn, Its seems like the first couple of days all hindrances attack to a point where I opened my eyes this morning meditation and thought: 'How did I get here?...Can you please comment.",Hindrances,Meditation retreats,,,,,,,,,,,,
3,,,0:00 ,3:43,,Is body scan as a meditation practice done in the Ajahn Chah tradition? Is there a sutta where the Buddha talks about it?,Body scanning,Ajahn Chah lineage,Sutta,,Unattractiveness,Mindfulness of body,Elements,Recollection/Death,Disenchantment,,Yes,,Mindfulness of body,110
3,Quote,,,,,Ajahn Chah would recommend doing anything that worked.,Ajahn Chah,Right Effort,,,,,,,,,,,,
3,Reference,,,,,Chanting Book p. 60: Reflection on the Thirty-Two Parts.,Unattractiveness,,,,,,,,,,,,,
3,Sutta,,,,,"MN 10.4: Satipaṭṭhāna Sutta, mindfulness of body section.",Mindfulness of body,,,,,,,,,,,,,
3,,,3:43 ,4:17,,Is there something in the body that will help you identify the defilement of delusion?,Mindfulness of body,Delusion,,,Self-identity view,,,,,,Yes,,Delusion,80
3,,o,4:16 ,6:36,,"If one has read the Majjhima Nikaya, what text of the Pali canon do you recommend reading next?",Learning,Sutta,Tipiṭaka,,,,,,,,Yes,,Sutta,100
3,,o,6:35 ,,,I'm having trouble integrating some of the teachings in the context of preparing to have a child...How might one be fully open to the lightness and joy surrounding birth while remaining deeply aware of these other truths of existence?,Family,Birth,Characteristics of existence,,Trust,Heedfulness,Generosity,,,,,,Birth,120
3,,,12:41,17:18,,"Sorry, I missed something. Did you say that instead of dwelling on our hindrances and getting depressed, we could instead work with the Factors of Enlightenment to brighten the mind? What are the Factors you would suggest?",Factors of Awakening,Gladdening the mind,,,Divine Abidings,Perfections,Right Effort,Hindrances,,,Yes,,,
3,Reflection,2s,,,,on Unbinding as a translation of Nibbāna.,Nibbāna,Translation,Ajahn Ṭhānissaro,,,,,,,,,,,
3,Indirect quote,,,,,Practicing Dhamma is like taking a screwdriver and unscrewing something rather than putting the screwdriver in and tightening it up.,Ajahn Chah,Practicing in accordance with Dhamma,Similes,,,,,,,,,,,
3,,,17:18 ,,,Can you please give perspective on thoughts/feelings of inadequacy and comparison to others?,Guilt/shame/inadequacy,,,,,,,,,,,,,
3,,,23:48 ,,,Can you please talk about qualities (physical sensations) one would experience in different Jhana sates?,Jhāna,,,,,,,,,,,,,
3,,,26:24 ,,,Are there harmful states of concentration? How would you potentially go down the wrong path? Is there a question you could ask yourself?,Right Concentration,Wrong concentration,,,,,,,,,,,,
3,,,30:16 ,,,"About a year ago, I was bullied and sexually harassed by a married male coworker...Any guidance as to how I can work with this and move beyond it?",Abuse/violence,Sexual misconduct,Work,,Goodwill,,,,,,,,,
3,,,34:10 ,37:43,,"Would you please elaborate on mental formations and volition? I thought mental formations are thoughts and images that pop up and are not necessarily originated by our will or wish. Otherwise we could also easily will or wish them away. Our effort is in recognizing them when they arise, not cling to them, and let them pass like clouds. Am I mistaken?",Volitional formations,Volition,,,,,,,,,Yes,,,
3,,,37:43 ,40:41.5,,Once I aspired to open my mind beyond this conditioned world. Now I mostly try to be at ease with my limitations. Am I mistargeting something important?,Stages of awakening,Unconditioned,Contentment,,Idealism,Four Noble Truths,,,,,Yes,,,
3,,,40:42 ,,,Some monks have told me I'm selfish for being so focused on release. They say I should help others more. What are your thoughts?,Release,Selfishness,Generosity,,,,,,,,,,,
3,,,42:10 ,43:44.5,,What are the four stages of enlightenment? What defilements have the four noble beings shed?,Stages of awakening,Unwholesome Roots,,,Drawbacks,Liberation,,,,,Yes,,Stages of awakening,70
3,Quote,,,,,"When we think of enlightenment, it's a being who is willing and able to relinquish those things that are complicating and constricting.",Liberation,Relinquishment,,,,,,,,,,,,
3,,,43:45 ,47:20,,Could you please expand on compassionate seclusion in interactive daily life (both on and off retreat)?,Compassion,Seclusion,Everyday life,,Time management,,,,,,Yes,,Seclusion,110
3,,,47:20 ,,,Thank you Luang Por for your time and teachings. I would like to hear more about the idea of restraint (especially in regards to raising a teenager).,Family,Sense restraint,Children,,,,,,,,,,,
3,,,50:57 ,,,Would you please talk a bit about karma in past lives...I'm asking for future karmic results and preventing negative ones.,Kamma,Rebirth,,,,,,,,,,,,
3,,,53:16 ,,,How do you teach noting/labeling in meditation?,Noting,,,,,,,,,,,,,
3,,,56:56.5,59:11,,"I was interested to hear the definition of mental formations as volitional. When I look at my mind, it sometimes seems like an undirected random generator of flashing images and unbidden thoughts, sometimes embarassingly perverse. I can only rest easily when I recollect not-self. Can you help me reconcile that with volitionality?",Volitional formations,Volition,Heart/mind,Proliferation,Perception,Relinquishment,Mindfulness,Discernment,,,Yes,,Volitional formations,130
3,Extra tags,,,,,,Not-self,,,,,,,,,,,,,
3,,,59:11 ,,,"What suggestions do you have when thoughts of transgression of sila arise. I cannot change the past, but I have regrets.",Precepts,Restlessness and worry,,,,,,,,,,,,
3,,,1:04:16 ,,,Please explain the inner workings of right intention and its karmic effect.,Right Intention,Kamma,Volition,,,,,,,,,,,
4,,,00:00 ,,,"Please explain again: When one restores concentration by focusing on the in-and-outtake of the breath, is one using the vinnana/consciousness of the grasping mind?",Mindfulness of breathing,Concentration,Consciousness,Clinging,,,,,,,,,,
4,,,3:14 ,,,During retreats I sometimes have dreams in which my actions are unskillful. Does one eventually keep the precepts even in dreams?,Precepts,Dreams,,,,,,,,,,,,
4,,,4:31,,,"'Like exercise makes the body strong, inner stillness makes the mind strong.' Why stillness and not awareness?",Calming meditation,Tranquility,Present moment awareness,,,,,,,,,,,
4,,,6:18,,,It has been a few years since my last retreat. May I request a reminder on how to practice metta mediation on oneself...I seem to have forgotten.,Goodwill,,,,,,,,,,,,,
4,,,15:49 ,,,Would you please give an example of how wholesome qualities can condition unwholesome qualities?,Skillful qualities,Unskillful qualities,Conditionality,,,,,,,,,,,
4,,,18:12 ,,,I feel like a kid whose father has told a story and there is more to tell...Please father do tell (about non-complicated thoughts etc.).,Proliferation,,,,,,,,,,,,,
4,,,19:00 ,,,I have a hard time ending or letting go of relationships after they no longer serve me or prove to be unskillful people...Is this attachment to person or aversion/ fear etc of the unknown?,Relationships,Relinquishment,Clinging,Fear,,,,,,,,,,
4,,,22:55 ,26:21,,How do you decrease the times an obsessive thought arises in the mind?...What is obsession anyways?,Restlessness and worry,Proliferation,,,,,,,,,Yes,,,
4,,,26:23,33:32,,"I've been sitting on this question for the past few days. It has to do with dispassion, shedding, simplifying and being easily satisfied on the one end of the spectrum and being engaged and active in the world, even taking an unpopular stand, on the other end. How can one practice shedding internally but still be responsive and engaged regarding the suffering from environmental and social issues? It seems that would complicate things, but that is where my heart is drawn.",Dispassion,Simplicity,Contentment,Politics and society,Suffering,,,,,,Yes,,Politics and society,180
4,Extra tags,,,,,,Environment,,,,,,,,,,,,,
4,Quote,,,,,"When there is displassion and shedding, a clarity arises in the mind, when can then more easily be applied to something that is useful or beneficial without complicating things.",Dispassion,Simplicity,Clear comprehension,Compassion,,,,,,,,,,
4,Quote,ua,,,,"""Do you think there's any hope for saving all the forests in Thailand?""—""I don't think there's hope that it's going to make a huge impact right now. I'm just planting the seeds for the future, and maybe something will change. It's not an option not to do it.""",Ajahn Pasanno,Environment,Culture/Thailand,,,,,,,,,,,
4,,,33:37,36:31,,"Could you please explain again the differences between sañña, saṅkāra, and viññana? I'm still not getting it.",Perception,Volitional formations,Consciousness,,Memory,Sense bases,Dependent origination,Conditionality,Suffering,,Yes,,Dependent origination,80
4,Indirect quote,,,,,"All the details of the process of dependent origination....It's like falling out of a tree. As you go down, you're not really counting branches. You just know that when you hit the bottom, it's going to hurt.|Ajahn Chah",Ajahn Chah,Dependent origination,Suffering,,,,,,,,,,,
4,,,36:32,,,Is there an obligation to reconcile with family before your death or theirs (especially when family has been particularly unskillful towards us)?,Family,Death,Forgiveness,,,,,,,,,,,
4,,,42:38 ,,,What is meant by 'fools'...the Buddha's definition of a fool.,,,,,,,,,,,,,,
4,,,43:39 ,,,"Is there anything skillful about crying, the flow of tears?",Grief,,,,,,,,,,,,,
4,,,45:38 ,,,How does one reconcile the apparent complete lack of control that is experienced in meditation...with the apparent need to control one's circumstances off the cushion. Is it possible to live with complete non-contention and still have an organized life?,Everyday life,Meditation,Volition,Non-contention,,,,,,,,,,
5,Indirect quote,,0:19,0:42,,The good thing about death is that it is one of the few things you can do just as easily lying down.|Woody Allen,Death,Posture/Lying down,Humor,,,,,,,,Yes,,,
5,,,0:42,8:33,,What is the funeral protocol for monks? What about non-monastics in the West?,Funerals,Monastic life,Lay life,,Ceremony/ritual,Culture/Thailand,Culture/West,Chithurst,,,Yes,,,
5,Recollection,,,,,Details of Ajahn Chah's funeral.,Ajahn Chah,Funerals,Lodging,Food,,,,,,,,,,
5,Recollection,,,,,The complicated cremation of Venerable Master Hua.,Master Hsuan Hua,Funerals,Culture/West,,,,,,,,,,,
5,,,8:42 ,,,"Over the last couple of years, I've been noticing that memory retention isn't quite what it used to be...In your experience, has meditation practice helped sharpen the memory?",Memory,Ageing,Meditation,,,,,,,,,,,
5,,,10:37,14:02,,I've been reflecting on 'no-self' and it hasn't quite been resonating. Instead it feels like daunting abstraction. Can you suggest a simple way to approach this?,Not-self,,,,Self-identity view,Impermanence,Naturalness,Form,,,Yes,,Not-self,80
5,,,14:02 ,,,I saw one of your new publications 'Don't Hold Back.' Why did you choose this title? The chapter on chanting answered many questions I had.,Dhamma books,Ajahn Pasanno,Chanting,,,,,,,,,,,
5,,,15:03 ,,,"Funeral and memorial services are not only important for those left behind, but maybe important for the new traveler in afterlife. Could you say more about supporting a dead person? What kind of support and how long? Years? Does 'human support' matter or does 'karma' of each individual 'take care of it'?",Funerals,Death,Rebirth,Kamma,,,,,,,,,,
5,,,23:25 ,,,I found your explanation of the theme of 'constancy' in practice as a constancy in keeping a bright and awake mind more helpful and do-able than a constancy in keeping to one meditation object as is sometimes taught. Could you please say more.,Right Effort,Gladdening the mind,Unification,,,,,,,,,,,
5,,,26:38,,,Would you please comment on 'The Highest Blessings' where is reads: 'Avoiding those of foolish ways...and cherishing family.' What if family members engage in foolish ways like addiction to alcohol and one can not always avoid them? Can one cherish one of foolish ways?,Family,Spiritual friendship,Intoxicants,,,,,,,,,,,
5,,,30:22,31:14,,"It seems that every year I expect less from myself at a retreat. It seems also, by and large, that every year retreat becomes easier, happier, and more peaceful. Would you say this is because: 1) I am getting wiser? 2) I am abandoning all intentions? or 3) I am running out of hormones?",Long-term practice,Meditation retreats,Happiness,,Spaciousness,,,,,,Yes,,Long-term practice,80
5,,,32:18,34:21,,Where do the Brahma-Viharas fit into the 4 Noble Truths?',Four Noble Truths,Divine Abidings,,,Eightfold Path,Right Intention,,,,,Yes,,Divine Abidings,120
5,,,34:25 ,,,Thank you for the most profound expository discourse on Ananpanasati...How do you practice it? Do you memorize it and note all the aspects (tick them off and get a certificate)?,Mindfulness of breathing,,,,,,,,,,,,,
5,,,39:49 ,,,"Is the pursuit of peace, cessation, stillness any different from any other pursuit or desire?",Tranquility,Cessation,Desire,,,,,,,,,,,
5,,,43:03 ,,,Can you please speak about dealing with physical pain during a sit (particularly back pain and headaches)?,Pain,Posture/Sitting,,,,,,,,,,,,
5,,,49:38 ,54:46,,"It seems like the 'Reflection on the 32 Parts' of the body is missing several parts. Nose, muscles, sex organs, etc. Is it meant to be comprehensive? Or is it just the ugly bits?",Unattractiveness,,,,Elements,Human,Disenchantment,Equanimity,,,Yes,,Unattractiveness,150
5,Reference,,,,,Chanting Book p. 60: Reflection on the Thirty-Two Parts.,,,,,,,,,,,,,,
5,Sutta,,,,,MN 10.10: Simile of different grains.,Unattractiveness,Similes,,,,,,,,,,,,
5,,,54:48.5,56:21,,Please explain which comes first birth or becoming for example with anger or any feeling or character?,Birth,Becoming,Dependent origination,,,,,,,,Yes,,Birth,80
6,,,00:00 ,,,Can you tell us about how Ajahn Chah taught Western monks when he didn't know English?,Ajahn Chah,History/Western Buddhist monasticism,Language,,,,,,,,,,,
6,,,3:38 ,,,"If this question is okay, could you please tell us any more about how Ajahn Chah challenged you in those first five years – and/or later?",Ajahn Chah,Ajahn Pasanno,,,,,,,,,,,,
6,,,5:23,,,"I'm trying to be with the breath without controlling it. When I let go of control, the breath seems to accelerate so that I can't keep up with it. Help!",Mindfulness of breathing,Volition,,,,,,,,,,,,
6,,,9:34 ,,,Is it okay to do standing meditation in here during meditation sessions when nothing else is working for sleepiness or restlessness?,Posture/Standing,Sloth and torpor,Restlessness and worry,,,,,,,,,,,
6,,,12:01 ,,,"In the chant 'Suffusion with the Divine Abidings,' what does it mean “I will abide pervading the all encompassing world with a heart imbued with loving-kindness. Likewise the second...third...fourth'? Why does it not say something like 'pervading the entire heart'?",Divine Abidings,Heart/mind,,,,,,,,,,,,
6,,,13:14 ,,,Thank you for the teachings...Could you speak about the heart and mind which appear to be used interchangeably. How can we listen with discernment to the heart? How can we cultivate its strength?,Heart/mind,Discernment,,,,,,,,,,,,
6,,,18:01 ,,,"Was metta taught as a concentration earlier than Buddhaghosa? Also, how is it taught in the Thai Forest Tradition now?",Goodwill,Commentaries,Thai Forest Tradition,,,,,,,,,,,
6,Comment,,23:00 ,,,"Ajahn Karunadhammo (it certainly takes a lot of ink to write out your name), your talk today was incredibly timely.",Gratitude,,,,,,,,,,,,,
6,Comment,,23:33 ,,,"Thank you all for the abundant, exalted, immeasurable gratitude that I am presently experiencing as streaming out of my citta and heading right toward you. Don't duck.",Gratitude,,,,,,,,,,,,,
6,,,24:00 ,,,"In the article 'Consciousnesses' by Ajahn Lee, he talks about beings that inhabit the mind and body...What are your thoughts on this? When seeing unusual phenomena that can be interpreted in this way, what is a good course of action?",Ajahn Lee Dhammadharo,Psychic powers,Realms of existence,,,,,,,,,,,
6,,,27:23 ,,,Would you please describe the four ways of skillfully answering or asking questions or the different types of questions?,Questions,,,,,,,,,,,,,
6,,,28:40 ,,,"In 'Homage to the Sangha' chant, what are the 'Four pairs, the eight kinds of Noble Beings?'",Recollection/Saṅgha,Stages of awakening,,,,,,,,,,,,
6,,,29:52 ,35:22,,"It makes sense that loving-kindness is the antidote to a person-directed ill-will, but what is the antidote to a more recurring, low-level, general aversion to experience?",Goodwill,Ill-will,Aversion,,Heart/mind,Visualization,,,,,Yes,,Aversion,110
6,Edited audio,,,4:45,,TG2013_S06_F13.mp3,,,,,,,,,,,,,,
